{
  "adapter": "examples/classification-dbpedia-14/adapter.py",
  "build": {
    "dirty": false,
    "ref": "73604a08b84a7def4f4569102514bdc9e9ec0238",
    "source": "git"
  },
  "config_id": "db_constant_n200_v1",
  "created_at": "2026-09-27T14:12:55Z",
  "dataset_id": "dbpedia_280",
  "fingerprint": {
    "arm": {
      "config_id": "db_constant_n200_v1",
      "params": {
        "family": "baseline",
        "label": "Company",
        "price_tier": "free",
        "provider": "constant"
      }
    },
    "data": {
      "dataset_id": "dbpedia_280",
      "items_sha256": "a7419dc6a5876490c3ed1f96eae9398969a2f8b794e744d45ace5790bc0146f2",
      "n_items": 280,
      "reference_id": "gold/dbpedia_280",
      "reference_tier": "gold",
      "references_sha256": "e0564fe65fb011e37717e037a6ad662f44e796b7d7de8e62ed2344ba56fa7a8a"
    },
    "hash": "508b9cb059913d7a90abb1b0a7541c804b1906e9a7b872ae77da044cb12df016",
    "host": {
      "cpu_count": 12,
      "label": "mac-dev",
      "platform": "Darwin/x86_64",
      "processor": "i386",
      "python": "3.11.8",
      "release": "24.6.0"
    },
    "instrument": {
      "adapter": {
        "id": "examples/classification-dbpedia-14/adapter.py",
        "sha256": "58b55c964f8bb40746c359621beb25bfd0a071fca079961bdf15be1e7c0a77a8"
      },
      "harness": {
        "commit": "73604a08b84a",
        "dirty": false
      }
    },
    "system_under_test": {
      "libraries": {
        "openai": "3.19.2"
      },
      "model": {
        "id": "constant:Company",
        "identity_declared": true,
        "label": "Company",
        "labels": [
          "Company",
          "EducationalInstitution",
          "Artist",
          "Athlete",
          "OfficeHolder",
          "MeanOfTransportation",
          "Building",
          "NaturalPlace",
          "Village",
          "Animal",
          "Plant",
          "Album",
          "Film",
          "WrittenWork"
        ],
        "labels_sha256": "d3a33437c1e2b2fe45fdb7a425b14796d89d31a0d8919d899149e27f5c6f899d",
        "parser_sha256": "6cc7cbce25ef74dbcdaa7f18763cfaaf8ea7b2a0e0cc0222e4d70f9b92cf2fc6",
        "provider": "constant",
        "revision": null,
        "revision_source": "unavailable"
      }
    },
    "version": 4
  },
  "goal": "entity_topic_dbpedia",
  "metric_kinds": {
    "answer_words": "descriptive",
    "confidence": "descriptive",
    "correct": "quality",
    "correct_after_repair": "descriptive",
    "fmt_markdown": "descriptive",
    "fmt_verbose": "descriptive",
    "parsed": "quality",
    "reasoning_tokens": "descriptive",
    "truncated": "descriptive"
  },
  "n_items": 280,
  "params": {
    "family": "baseline",
    "label": "Company",
    "price_tier": "free",
    "provider": "constant"
  },
  "primary_metric": "correct",
  "providers_seen": {},
  "reference_tier": "gold",
  "round": "r1",
  "run_id": "db_constant_n200_v1_20260927T141254Z",
  "scores": {
    "answer_words": 1.0,
    "correct": 0.071429,
    "correct_after_repair": 0.0,
    "cost_usd": 0.0,
    "fmt_markdown": 0.0,
    "fmt_verbose": 0.0,
    "latency_ms": 0.003186,
    "parsed": 1.0,
    "total_cost_usd": 0.0
  },
  "warmup_ms": 0.117
}
