{
  "adapter": "examples/summarization-cnn-dailymail/adapter.py",
  "build": {
    "dirty": null,
    "ref": "eval-harness-scenario",
    "source": "EVAL_BUILD_REF"
  },
  "config_id": "cnn_mistral_s_n200_v1",
  "created_at": "2026-10-25T13:39:55Z",
  "dataset_id": "cnn_dailymail_200",
  "derived": {
    "at": "2026-10-25T13:39:55Z",
    "from": "cnn_mistral_s_n200_v1_20260926T111901Z",
    "kind": "judge",
    "with": {
      "judges": [
        {
          "family": "gemma",
          "fp": "5031d8671837eb80",
          "id": "gemma_l",
          "model": "eval-gemma-31b"
        },
        {
          "family": "qwen",
          "fp": "c0ecf5eb99cea0b5",
          "id": "qwen_s",
          "model": "eval-qwen-flash"
        }
      ],
      "judging_set_id": "cnn_dailymail_200-29arms-a079833ca3c9",
      "judging_set_sha256": "a079833ca3c95369c648601dc9432f7fccb3e251ef86ebafcaeba0a541c8f9db",
      "label": "validated on summeval_100 (provenance)",
      "prompt_sha256_at_16": "6c02d00929048d9c3fea511af40c3ddf90fdf1550afb7713d3f5f4d86e44f5ee",
      "protocol": {
        "blinding": true,
        "block_sizes": [
          15,
          14
        ],
        "order_seed": 0,
        "outputs_per_call": 16
      },
      "scorer_id": "judge-summ-v1",
      "scorer_sha256": "d604095cace5f53746b513a43f3a5623d56bcffe67f228c96e390414a268bacc",
      "self_family": {
        "gemma_l": false,
        "qwen_s": false
      },
      "source_reference_tier": "gold",
      "validated": true
    }
  },
  "fingerprint": {
    "arm": {
      "config_id": "cnn_mistral_s_n200_v1",
      "labels": {
        "family": "mistral",
        "price_tier": "small",
        "usd_per_mtok_in": 0.05,
        "usd_per_mtok_out": 0.15
      }
    },
    "data": {
      "dataset_id": "cnn_dailymail_200",
      "items_sha256": "257feda902391b934b8cde940c15e91201096dbe96ec5a81337e9da007ce3ec7",
      "n_items": 200,
      "reference_id": "gold/cnn_dailymail_200",
      "reference_tier": "gold",
      "references_sha256": "5d0b02c3798017535572d24dd3ce0592332938a0c91e93684d163963a60a7cd9"
    },
    "data_sha256": "a9b234845c4f4d69a498556c1f6324f5839721e805795a1f3d5946301307a0e8",
    "deployment": {
      "declared": {
        "alias": "eval-mistral-small",
        "endpoint": "http://127.0.0.1:4001",
        "id": "openrouter/mistralai/mistral-small-3.2-24b-instruct",
        "id_source": "proxy-model-info",
        "provider_routing": null
      },
      "hosted": {
        "provider": "litellm",
        "provider_id": "openrouter/mistralai/mistral-small-3.2-24b-instruct",
        "route": null
      },
      "id": "eval-mistral-small",
      "in_process": false,
      "libraries": null,
      "model": "eval-mistral-small",
      "provider": "litellm",
      "server": null,
      "source": "adapter",
      "weights": {
        "digest": null,
        "file_hash": null,
        "precision": null,
        "quantization": null,
        "revision": null,
        "revision_source": "api-model-string"
      },
      "where": {
        "backend": null,
        "device": null,
        "machine": null
      }
    },
    "deployment_sha256": "575be7265401604cafa07ef71353994382c5f44dee25abd9e17139bb7848032a",
    "hash": null,
    "hash_invalid_because": "scores were produced by a judge scorer, not the adapter this fingerprint was built from; see derived.with",
    "instrument": {
      "adapter": {
        "id": "judge-score:judge-summ-v1",
        "sha256": "4b5440bf0599fd12fd2d69a2697f1b0cdf54871486ef228b60be554750e82887"
      },
      "harness": {
        "commit": "e0810991f3fb",
        "dirty": true
      }
    },
    "instrument_sha256": "1ce00cf9648035ddc811da06a89cf8d2ed855f2fac3f5ed3e5e3f6d0bbba01df",
    "runner": {
      "cpu_count": 12,
      "label": null,
      "libraries": {
        "numpy": "2.4.6",
        "openai": "3.19.2",
        "rouge-score": "0.1.2"
      },
      "platform": "Darwin/x86_64",
      "processor": "i386",
      "python": "3.11.8",
      "release": "24.6.0"
    },
    "settings": {
      "declared": {
        "prompt_sha256": "d98ecfbd4054a47476257c2a48ab9f9fc8731098afe4bc1093c69e89c0cbe2f0",
        "reasoning": {
          "enabled": false
        },
        "temperature": 0.0
      },
      "max_tokens": 1200,
      "prompt_file": "prompt.txt",
      "reasoning": {
        "enabled": false
      },
      "temperature": 0.0
    },
    "settings_sha256": "3a1994b513b8640a68e264b318c09dda581082a53ddb3403a465b6399b9eba7e",
    "version": 5
  },
  "goal": "news_summary_cnn",
  "metric_kinds": {
    "cost_usd": "cost",
    "judge_gemma_l": "quality",
    "judge_qwen_s": "quality",
    "judge_score": "quality",
    "latency_ms": "speed",
    "reasoning_tokens": "descriptive",
    "self_family_gemma_l": "descriptive",
    "self_family_qwen_s": "descriptive",
    "tokens_in": "cost",
    "tokens_out": "cost",
    "truncated": "descriptive"
  },
  "n_items": 197,
  "params": {
    "family": "mistral",
    "max_tokens": 1200,
    "model": "eval-mistral-small",
    "price_tier": "small",
    "prompt_file": "prompt.txt",
    "provider": "litellm",
    "reasoning": {
      "enabled": false
    },
    "temperature": 0.0,
    "usd_per_mtok_in": 0.05,
    "usd_per_mtok_out": 0.15
  },
  "primary_metric": "judge_score",
  "providers_seen": {
    "DeepInfra": 9,
    "Parasail": 2,
    "Venice": 189
  },
  "run_id": "cnn_mistral_s_n200_v1_20260926T111901Z",
  "scores": {
    "cost_usd": 8.91365e-05,
    "judge_gemma_l": 4.902284264,
    "judge_qwen_s": 4.6941624365,
    "judge_score": 4.7982233503,
    "latency_ms": 2826.3447563452,
    "reasoning_tokens": 0.0,
    "self_family_gemma_l": 0.0,
    "self_family_qwen_s": 0.0,
    "tokens_in": 753.614213198,
    "tokens_out": 77.614213198,
    "total_cost_usd": 0.01755988,
    "total_tokens_in": 148462.0,
    "total_tokens_out": 15290.0,
    "truncated": 0.0
  },
  "source_created_at": "2026-09-26T11:28:29Z",
  "warmup_ms": 1788.797
}
