{
  "adapter": "examples/triage-fleet/adapter.py",
  "build": {
    "dirty": false,
    "ref": "045ce221b383a3dd047b5de8d2a0a9d3848338cb",
    "source": "git"
  },
  "config_id": "triage_baseline_pro_v1",
  "created_at": "2026-10-30T14:57:06Z",
  "dataset_id": "orrery_triage_v1_labelled",
  "fingerprint": {
    "arm": {
      "config_id": "triage_baseline_pro_v1",
      "labels": {
        "usd_per_mtok_in": 0.816,
        "usd_per_mtok_out": 1.632
      }
    },
    "data": {
      "dataset_id": "orrery_triage_v1_labelled",
      "items_sha256": "d428aca49adc8e762dcbbcad6c9a1dba1ac4e4e3315ff26025af975faba1176a",
      "n_items": 65,
      "reference_id": "gold/orrery_triage_v1_labelled",
      "reference_tier": "gold",
      "references_sha256": "f617ad3bb9bb9f5feb8ffe54e0ef1b9b05dfb316fac13f63a925f9d35fb191cd"
    },
    "data_sha256": "c3061a4a7aa904ed81ad3d35063b140c1456f89affc2d85924308ef94fe47205",
    "deployment": {
      "declared": {
        "fleet_code_sha256": "248e25030011aab82f5798eeb7c74fd03f2d7cfd04866b8b017d3740663727d9",
        "fleet_commit": "f07efa9"
      },
      "hosted": {
        "provider": "gateway",
        "provider_id": null,
        "route": null
      },
      "id": "eval-fleet-triage-pro",
      "in_process": false,
      "libraries": null,
      "model": "eval-fleet-triage-pro",
      "provider": "gateway",
      "server": null,
      "source": "adapter",
      "weights": {
        "digest": null,
        "file_hash": null,
        "precision": null,
        "quantization": null,
        "revision": null,
        "revision_source": "unavailable"
      },
      "where": {
        "backend": null,
        "device": null,
        "machine": null
      }
    },
    "deployment_sha256": "892d95ee22c18c8a538f2faf81659f25514633e24440742be5f419a01be2f619",
    "hash": "8653d4be58852e4438ac1ccaa943802aeeab5463b539f7375925e59f25110bc0",
    "instrument": {
      "adapter": {
        "id": "examples/triage-fleet/adapter.py",
        "sha256": "9e899d6853cb4065ab07f1d44c08120d0a19ad282abdfdc0e95a3e63262cca81"
      },
      "harness": {
        "code_sha256": "0ab386969208f46c7448153422d5a5ab07833d963869b69fc216a6cd28feb110",
        "commit": "045ce221b383",
        "dirty": false,
        "installed": false,
        "version": "0.5.0"
      }
    },
    "instrument_sha256": "881169d7397bb940df048ea000fa9384e2471bd9860717dbcaa02d6ddf9daa33",
    "runner": {
      "cpu_count": 32,
      "label": null,
      "libraries": {
        "anthropic": "2.3.0",
        "numpy": "2.5.4",
        "openai": "3.41.0",
        "rouge-score": "0.1.2"
      },
      "platform": "Linux/x86_64",
      "processor": null,
      "python": "3.14.7",
      "release": "7.2.5-3-omarchy"
    },
    "settings": {
      "declared": {
        "prompt_sha256": "77f26d87ad9f4d117cd1cbdbd5be9bbb5fcd9666294055c37376fe6938bd1131"
      }
    },
    "settings_sha256": "cb112319a55187ab7f0a7b1b310f901d796aa0711f9eca2a777f7ac55f28d74c",
    "version": 5
  },
  "goal": "triage_orrery",
  "metric_directions": {
    "escalated": "lower",
    "false_alarm": "lower",
    "false_dismiss": "lower",
    "model_escalated": "lower",
    "model_false_alarm": "lower",
    "model_false_dismiss": "lower",
    "silent_drop": "lower",
    "table_miss": "lower"
  },
  "metric_kinds": {
    "resumed": "descriptive"
  },
  "n_items": 65,
  "params": {
    "model": "eval-fleet-triage-pro",
    "provider": "gateway",
    "usd_per_mtok_in": 0.816,
    "usd_per_mtok_out": 1.632
  },
  "primary_metric": "false_dismiss",
  "providers_seen": {},
  "reference_tier": "gold",
  "repeat_index": 2,
  "run_id": "triage_baseline_pro_v1_20261030T135822Z_r2",
  "scores": {
    "correct": 0.584615,
    "cost_usd": 0.004981,
    "escalated": 0.430769,
    "false_alarm": 0.709677,
    "false_dismiss": 0.147059,
    "latency_ms": 26427.547448,
    "model_correct": 0.461538,
    "model_escalated": 0.0,
    "model_false_alarm": 0.322581,
    "model_false_dismiss": 0.617647,
    "n_probes": 1.553846,
    "resumed": 0.0,
    "table_miss": 0.0,
    "tokens_in": 3496.415385,
    "tokens_out": 1304.030769,
    "total_cost_usd": 0.32378146,
    "total_tokens_in": 227267.0,
    "total_tokens_out": 84762.0
  }
}
