{
  "adapter": "examples/retrieval-scifact/adapter.py",
  "build": {
    "dirty": false,
    "ref": "0e20aaeb3dcabfcb0f9832740764147ceb9bffff",
    "source": "git"
  },
  "config_id": "sf_gemma_s_n200_v1",
  "created_at": "2026-09-29T20:21:59+02:00",
  "dataset_id": "scifact_200",
  "derived": {
    "at": "2026-09-29T20:21:59+02:00",
    "from": "sf_gemma_s_n200_v1_20260928T185941Z",
    "kind": "reparse",
    "with": {
      "parser": "examples/_shared/retrieval.parse_ranking",
      "scorer_sha256": "a534747b2a5d9712a1965473ab8e1d60b82aa2f73cf385c789d0fb4e83a51cd3"
    }
  },
  "fingerprint": {
    "arm": {
      "config_id": "sf_gemma_s_n200_v1",
      "params": {
        "corpus_id": "scifact",
        "family": "gemma",
        "max_tokens": 700,
        "model": "eval-gemma-3-27b",
        "price_tier": "small",
        "prompt_file": "prompt.txt",
        "provider": "rerank",
        "reasoning": {
          "enabled": false
        },
        "rerank_k": 20,
        "snippet_chars": 900,
        "temperature": 0.0,
        "top_k": 100,
        "usd_per_mtok_in": 0.07,
        "usd_per_mtok_out": 0.15
      }
    },
    "data": {
      "dataset_id": "scifact_200",
      "items_sha256": "b97dfe735a78eb4978cde41e2ca9a0bff424de9e6a0a2bdada5d167e3423004d",
      "n_items": 200,
      "reference_id": "gold/scifact_200",
      "reference_tier": "gold",
      "references_sha256": "b522e08017ebc7dd71c5627bccfdd688c5124096df8a5e6454684141bc361d99"
    },
    "hash": null,
    "hash_invalid_because": "rankings were rebuilt from stored LLM replies with a parser this fingerprint does not describe; see derived.with",
    "host": {
      "cpu_count": 12,
      "label": "mac-dev",
      "platform": "Darwin/x86_64",
      "processor": "i386",
      "python": "3.11.8",
      "release": "24.6.0"
    },
    "instrument": {
      "adapter": {
        "id": "examples/retrieval-scifact/adapter.py",
        "sha256": "46cd2bd89061c9f3bff0493cce7ab292dd6f9b1bae7c7e482af0aebdd1479cee"
      },
      "harness": {
        "commit": "0e20aaeb3dca",
        "dirty": false
      }
    },
    "system_under_test": {
      "libraries": {
        "numpy": "1.26.4",
        "openai": "3.19.2",
        "scikit-learn": "1.9.1",
        "sentence-transformers": "3.4.1",
        "torch": "2.2.2",
        "transformers": "4.55.4"
      },
      "model": {
        "alias": "eval-gemma-3-27b",
        "bm25": {
          "b": 0.75,
          "epsilon": 0.25,
          "impl": "rank_bm25.BM25Okapi",
          "k1": 1.5
        },
        "corpus_id": "scifact",
        "corpus_n_docs": 5183,
        "corpus_sha256": "297643e2d005109d9fc25d460c080faa45b0cc3ad881ea002941c67b6e41984e",
        "endpoint": "http://127.0.0.1:4001",
        "first_stage": "bm25",
        "id": "eval-gemma-3-27b",
        "identity_declared": true,
        "max_tokens": 700,
        "prompt_sha256": "a81ef5d8b150e4c31bfbaee6bfd9f98b1d56dd27dfbdcc15511154f79066abbe",
        "provider": "rerank",
        "reasoning": {
          "enabled": false
        },
        "rerank_k": 20,
        "revision": null,
        "revision_source": "unavailable",
        "scorer_sha256": "51d9e8bd57bc2e75ceccce80b7d60157c42f9959cadf3d7e9cf738f73fd10d04",
        "snippet_chars": 900,
        "temperature": 0.0,
        "tokenizer_sha256": "67a185c8c30efefa133188f15ba429328086f837a642a17e347a5a2ee437b79d",
        "top_k": 100
      }
    },
    "version": 4
  },
  "metric_kinds": {
    "confidence": "descriptive",
    "duplicate_ids": "descriptive",
    "found_any": "descriptive",
    "mrr_10": "quality",
    "n_relevant": "descriptive",
    "n_returned": "descriptive",
    "ndcg_10": "quality",
    "parsed": "quality",
    "rank_of_first": "descriptive",
    "reasoning_tokens": "descriptive",
    "recall_10": "quality",
    "recall_100": "quality",
    "truncated": "descriptive",
    "unknown_ids": "descriptive"
  },
  "n_items": 200,
  "params": {
    "corpus_id": "scifact",
    "family": "gemma",
    "max_tokens": 700,
    "model": "eval-gemma-3-27b",
    "price_tier": "small",
    "prompt_file": "prompt.txt",
    "provider": "rerank",
    "reasoning": {
      "enabled": false
    },
    "rerank_k": 20,
    "snippet_chars": 900,
    "temperature": 0.0,
    "top_k": 100,
    "usd_per_mtok_in": 0.07,
    "usd_per_mtok_out": 0.15
  },
  "primary_metric": "ndcg_10",
  "providers_seen": {},
  "reference_tier": "gold",
  "run_id": "sf_gemma_s_n200_v1_20260928T185941Z",
  "scores": {
    "cost_usd": 0.0003034352,
    "duplicate_ids": 0.0,
    "found_any": 0.865,
    "latency_ms": 7071.06993,
    "llm_named_unknown": 0.045,
    "llm_parsed": 1.0,
    "mrr_10": 0.6937757936,
    "n_relevant": 1.135,
    "n_returned": 100.0,
    "ndcg_10": 0.7017049911,
    "parsed": 1.0,
    "rank_of_first": 3.025,
    "reasoning_tokens": 0.0,
    "recall_10": 0.776,
    "recall_100": 0.8585833333,
    "tokens_in": 3929.51,
    "tokens_out": 189.13,
    "total_cost_usd": 0.06068704,
    "total_tokens_in": 785902.0,
    "total_tokens_out": 37826.0,
    "truncated": 0.0,
    "unknown_ids": 0.0
  },
  "source_created_at": "2026-09-28T19:23:18Z",
  "warmup_ms": 2031.569
}
