{
  "adapter": "examples/classification-dbpedia-14/adapter.py",
  "build": {
    "dirty": false,
    "ref": "73604a08b84a7def4f4569102514bdc9e9ec0238",
    "source": "git"
  },
  "config_id": "db_llama_m_n200_v1",
  "created_at": "2026-09-27T15:21:47Z",
  "dataset_id": "dbpedia_280",
  "fingerprint": {
    "arm": {
      "config_id": "db_llama_m_n200_v1",
      "params": {
        "family": "llama",
        "max_tokens": 200,
        "model": "eval-llama-70b",
        "price_tier": "mid",
        "prompt_file": "prompt.txt",
        "provider": "litellm",
        "reasoning": {
          "enabled": false
        },
        "temperature": 0.0,
        "usd_per_mtok_in": 0.12,
        "usd_per_mtok_out": 0.3
      }
    },
    "data": {
      "dataset_id": "dbpedia_280",
      "items_sha256": "a7419dc6a5876490c3ed1f96eae9398969a2f8b794e744d45ace5790bc0146f2",
      "n_items": 280,
      "reference_id": "gold/dbpedia_280",
      "reference_tier": "gold",
      "references_sha256": "e0564fe65fb011e37717e037a6ad662f44e796b7d7de8e62ed2344ba56fa7a8a"
    },
    "hash": "43606d26ff3257ece6fd6dfa357caa661519d3e8d3cdaa17b1f65b42c2c6eb0f",
    "host": {
      "cpu_count": 12,
      "label": "mac-dev",
      "platform": "Darwin/x86_64",
      "processor": "i386",
      "python": "3.11.8",
      "release": "24.6.0"
    },
    "instrument": {
      "adapter": {
        "id": "examples/classification-dbpedia-14/adapter.py",
        "sha256": "58b55c964f8bb40746c359621beb25bfd0a071fca079961bdf15be1e7c0a77a8"
      },
      "harness": {
        "commit": "73604a08b84a",
        "dirty": false
      }
    },
    "system_under_test": {
      "libraries": {
        "openai": "3.19.2"
      },
      "model": {
        "alias": "eval-llama-70b",
        "endpoint": "http://127.0.0.1:4001",
        "id": "openrouter/meta-llama/llama-3.3-70b-instruct",
        "id_source": "proxy-model-info",
        "identity_declared": true,
        "labels": [
          "Company",
          "EducationalInstitution",
          "Artist",
          "Athlete",
          "OfficeHolder",
          "MeanOfTransportation",
          "Building",
          "NaturalPlace",
          "Village",
          "Animal",
          "Plant",
          "Album",
          "Film",
          "WrittenWork"
        ],
        "labels_sha256": "d3a33437c1e2b2fe45fdb7a425b14796d89d31a0d8919d899149e27f5c6f899d",
        "parser_sha256": "6cc7cbce25ef74dbcdaa7f18763cfaaf8ea7b2a0e0cc0222e4d70f9b92cf2fc6",
        "prompt_sha256": "758e514c7aab934f0ad0395805b4624b41946e99834b6a2ca0527e098e796db3",
        "provider": "litellm",
        "provider_routing": null,
        "reasoning": {
          "enabled": false
        },
        "revision": null,
        "revision_source": "api-model-string",
        "temperature": 0.0
      }
    },
    "version": 4
  },
  "metric_kinds": {
    "answer_words": "descriptive",
    "confidence": "descriptive",
    "correct": "quality",
    "correct_after_repair": "descriptive",
    "fmt_markdown": "descriptive",
    "fmt_verbose": "descriptive",
    "parsed": "quality",
    "reasoning_tokens": "descriptive",
    "truncated": "descriptive"
  },
  "n_items": 280,
  "params": {
    "family": "llama",
    "max_tokens": 200,
    "model": "eval-llama-70b",
    "price_tier": "mid",
    "prompt_file": "prompt.txt",
    "provider": "litellm",
    "reasoning": {
      "enabled": false
    },
    "temperature": 0.0,
    "usd_per_mtok_in": 0.12,
    "usd_per_mtok_out": 0.3
  },
  "primary_metric": "correct",
  "providers_seen": {
    "AkashML": 56,
    "Cloudflare": 13,
    "CoreWeave": 3,
    "DeepInfra": 140,
    "Groq": 8,
    "Parasail": 40,
    "SambaNova": 17,
    "Together": 3
  },
  "reference_tier": "gold",
  "run_id": "db_llama_m_n200_v1_20260927T151241Z",
  "scores": {
    "answer_words": 1.0,
    "correct": 0.978571,
    "correct_after_repair": 0.0,
    "cost_usd": 3e-05,
    "fmt_markdown": 0.0,
    "fmt_verbose": 0.0,
    "latency_ms": 1927.011332,
    "parsed": 1.0,
    "reasoning_tokens": 0.0,
    "tokens_in": 152.703571,
    "tokens_out": 2.778571,
    "total_cost_usd": 0.0084344,
    "total_tokens_in": 42757.0,
    "total_tokens_out": 778.0,
    "truncated": 0.0
  },
  "warmup_ms": 5703.381
}
