{
  "adapter": "examples/triage-fleet/adapter.py",
  "build": {
    "dirty": false,
    "ref": "e788e0ccd44a7c407b0616282a6e8a7452721fdf",
    "source": "git"
  },
  "config_id": "triage_stub_escalate_v1",
  "created_at": "2026-10-31T13:23:24Z",
  "dataset_id": "orrery_triage_v1_labelled",
  "derived": {
    "at": "2026-10-31T13:23:24Z",
    "from": "triage_stub_escalate_v1_20261031T072417Z",
    "kind": "rescore",
    "with": {
      "adapter": "examples/triage-fleet/adapter.py",
      "sha256": "77adc97b06a85e2dbb89100c1d2121c34b22f6194a4655d6fcf937427da492af"
    }
  },
  "fingerprint": {
    "arm": {
      "config_id": "triage_stub_escalate_v1",
      "labels": null
    },
    "data": {
      "dataset_id": "orrery_triage_v1_labelled",
      "items_sha256": "d428aca49adc8e762dcbbcad6c9a1dba1ac4e4e3315ff26025af975faba1176a",
      "n_items": 65,
      "reference_id": "gold/orrery_triage_v1_labelled",
      "reference_tier": "gold",
      "references_sha256": "f617ad3bb9bb9f5feb8ffe54e0ef1b9b05dfb316fac13f63a925f9d35fb191cd"
    },
    "data_sha256": "c3061a4a7aa904ed81ad3d35063b140c1456f89affc2d85924308ef94fe47205",
    "deployment": {
      "declared": {
        "fleet_code_sha256": "248e25030011aab82f5798eeb7c74fd03f2d7cfd04866b8b017d3740663727d9",
        "fleet_commit": "f07efa9"
      },
      "hosted": null,
      "id": "stub",
      "in_process": true,
      "libraries": {
        "anthropic": "2.3.0",
        "numpy": "2.5.4",
        "openai": "3.41.0",
        "rouge-score": "0.1.2"
      },
      "model": "stub",
      "provider": "stub",
      "server": null,
      "source": "adapter",
      "weights": {
        "digest": null,
        "file_hash": null,
        "precision": null,
        "quantization": null,
        "revision": null,
        "revision_source": "unavailable"
      },
      "where": {
        "backend": null,
        "device": null,
        "machine": null
      }
    },
    "deployment_sha256": "896030bc55a4fbb0108bcc03879cb9753be90fb89c6f764acf46a09898c4a728",
    "hash": null,
    "hash_invalid_because": "scores were recomputed by a different scorer than the one this fingerprint was built from; see derived.with",
    "instrument": {
      "adapter": {
        "id": "examples/triage-fleet/adapter.py",
        "sha256": "77adc97b06a85e2dbb89100c1d2121c34b22f6194a4655d6fcf937427da492af"
      },
      "harness": {
        "code_sha256": "0ab386969208f46c7448153422d5a5ab07833d963869b69fc216a6cd28feb110",
        "commit": "e788e0ccd44a",
        "dirty": false,
        "installed": false,
        "version": "0.5.0"
      }
    },
    "instrument_sha256": "47f881b113977a8475985ff5785b65bcc6b5ffc35d5fe03105d6dbe6eda8fb64",
    "runner": {
      "cpu_count": 32,
      "label": null,
      "libraries": null,
      "platform": "Linux/x86_64",
      "processor": null,
      "python": "3.14.7",
      "release": "7.2.5-3-omarchy"
    },
    "settings": {
      "declared": {
        "prompt_sha256": "77f26d87ad9f4d117cd1cbdbd5be9bbb5fcd9666294055c37376fe6938bd1131"
      },
      "stub_disposition": "escalate"
    },
    "settings_sha256": "6e32d80ea37b5f0ac548a6bd932dca1424df6b80c7d3e11ce8075bf79fe3de66",
    "version": 5
  },
  "goal": "triage_orrery",
  "metric_directions": {
    "deferred": "lower",
    "escalated": "lower",
    "false_alarm": "lower",
    "false_dismiss": "lower",
    "model_escalated": "lower",
    "model_false_alarm": "lower",
    "model_false_dismiss": "lower",
    "model_triage_cost": "lower",
    "no_decision": "lower",
    "silent_drop": "lower",
    "table_miss": "lower",
    "triage_cost": "lower",
    "triage_cost_p10": "lower",
    "triage_cost_p3": "lower"
  },
  "metric_kinds": {
    "resumed": "descriptive"
  },
  "n_items": 65,
  "params": {
    "provider": "stub",
    "stub_disposition": "escalate"
  },
  "primary_metric": "triage_cost",
  "providers_seen": {},
  "reference_tier": "gold",
  "run_id": "triage_stub_escalate_v1_20261031T072417Z",
  "scores": {
    "correct": 0.3538461538,
    "escalated": 1.0,
    "false_alarm": 1.0,
    "false_dismiss": 0.0,
    "latency_ms": 0.089713315,
    "model_correct": 0.3538461538,
    "model_escalated": 1.0,
    "model_false_alarm": 1.0,
    "model_false_dismiss": 0.0,
    "model_triage_cost": 0.4769230769,
    "n_probes": 1.0,
    "no_decision": 0.0,
    "resumed": 0.0,
    "table_miss": 0.0,
    "tokens_in": 1000.0,
    "tokens_out": 100.0,
    "total_tokens_in": 65000.0,
    "total_tokens_out": 6500.0,
    "triage_cost": 0.4769230769,
    "triage_cost_p10": 0.4769230769,
    "triage_cost_p3": 0.4769230769
  },
  "source_created_at": "2026-10-31T07:24:18Z"
}
