{
  "adapter": "examples/classification-ag-news/adapter.py",
  "build": {
    "dirty": false,
    "ref": "1e80be6531e2f71118762f498b4493e946f0c944",
    "source": "git"
  },
  "config_id": "ag_glm_l_n200_v1",
  "created_at": "2026-09-27T09:30:14Z",
  "dataset_id": "ag_news_200",
  "fingerprint": {
    "arm": {
      "config_id": "ag_glm_l_n200_v1"
    },
    "data": {
      "dataset_id": "ag_news_200",
      "items_sha256": "d7bf61eb3b27e79d492bbe5a445659813dfcacf6fadcae4d26255c45291bedd2",
      "n_items": 200,
      "reference_id": "gold/ag_news_200",
      "reference_tier": "gold",
      "references_sha256": "e671b1a159664de82a0a5f35d36150d81abc99d45ac19e7df8ec1d66164bcc04"
    },
    "data_sha256": "42c37455220776fdf99bbc061bb396453b6fed3842e8ae4d76e316d3392cd318",
    "deployment": {
      "declared": {
        "alias": "eval-glm-5",
        "endpoint": "http://127.0.0.1:4001",
        "id": "openrouter/z-ai/glm-5",
        "id_source": "proxy-model-info",
        "labels": [
          "World",
          "Sports",
          "Business",
          "Sci/Tech"
        ],
        "labels_sha256": "c7a1ee508b78c0e92f28d159d340a6537ac31ff70ff566430fe2507da58464a3",
        "parser_sha256": "87f75633ea16670ab5a3169fe3125c91107f84959e79c56dd2f17c66a418246d",
        "provider": "litellm",
        "provider_routing": null
      },
      "hosted": {
        "provider": "litellm",
        "provider_id": "openrouter/z-ai/glm-5",
        "route": null
      },
      "id": "eval-glm-5",
      "in_process": false,
      "libraries": null,
      "model": "eval-glm-5",
      "provider": "litellm",
      "server": null,
      "source": "adapter",
      "weights": {
        "digest": null,
        "file_hash": null,
        "precision": null,
        "quantization": null,
        "revision": null,
        "revision_source": "api-model-string"
      },
      "where": {
        "backend": null,
        "device": null,
        "machine": null
      }
    },
    "deployment_sha256": "51dd5e370d4a1975f464e65e5ba8046bff69986e0f4948d67b48e209cb92aa4b",
    "hash": "ec63166855d9a3e59a02ef1378315df013d6717abd79c38471e8e132849e8697",
    "instrument": {
      "adapter": {
        "id": "examples/classification-ag-news/adapter.py",
        "sha256": "8e4dffce35059b76949a0c95860cbcb5bd372fbdb6bdf33e0e55f4df78045b94"
      },
      "harness": {
        "commit": "1e80be6531e2",
        "dirty": false
      }
    },
    "instrument_sha256": "237e3b2ea03b64d4a1e2a7cdd7d8839afbeb26b2197aea0b2dd44801664a6703",
    "runner": {
      "cpu_count": 12,
      "label": "mac-dev",
      "libraries": {
        "numpy": "1.26.4",
        "openai": "3.19.2",
        "torch": "2.2.2",
        "transformers": "4.55.4"
      },
      "platform": "Darwin/x86_64",
      "processor": "i386",
      "python": "3.11.8",
      "release": "24.6.0"
    },
    "settings": {
      "declared": {
        "prompt_sha256": "ed3aeed55a5b5645151d03d7a518e932ed6da520c4b49bfdc85660dfbf562229",
        "reasoning": {
          "enabled": false
        },
        "temperature": 0.0
      },
      "family": "glm",
      "max_tokens": 200,
      "price_tier": "large",
      "prompt_file": "prompt.txt",
      "reasoning": {
        "enabled": false
      },
      "temperature": 0.0,
      "usd_per_mtok_in": 0.35,
      "usd_per_mtok_out": 1.4
    },
    "settings_sha256": "7c78e4bb2a11d209ea917e905453f2388ac4ecf041871e744aa73659f58e5255",
    "version": 5
  },
  "goal": "news_topic_ag",
  "metric_kinds": {
    "answer_words": "descriptive",
    "confidence": "descriptive",
    "correct": "quality",
    "correct_after_repair": "descriptive",
    "fmt_markdown": "descriptive",
    "fmt_verbose": "descriptive",
    "parsed": "quality",
    "reasoning_tokens": "descriptive",
    "truncated": "descriptive"
  },
  "n_items": 200,
  "params": {
    "family": "glm",
    "max_tokens": 200,
    "model": "eval-glm-5",
    "price_tier": "large",
    "prompt_file": "prompt.txt",
    "provider": "litellm",
    "reasoning": {
      "enabled": false
    },
    "temperature": 0.0,
    "usd_per_mtok_in": 0.35,
    "usd_per_mtok_out": 1.4
  },
  "primary_metric": "correct",
  "providers_seen": {
    "Amazon Bedrock": 19,
    "Baidu": 36,
    "GMICloud": 31,
    "Novita": 17,
    "SiliconFlow": 14,
    "StreamLake": 51,
    "Venice": 15,
    "Z.AI": 17
  },
  "reference_tier": "gold",
  "round": "r1",
  "run_id": "ag_glm_l_n200_v1_20260927T092352Z",
  "scores": {
    "answer_words": 6.045,
    "correct": 0.86,
    "correct_after_repair": 0.075,
    "cost_usd": 9.3e-05,
    "fmt_markdown": 0.0,
    "fmt_verbose": 0.09,
    "latency_ms": 1870.897815,
    "parsed": 1.0,
    "reasoning_tokens": 0.0,
    "tokens_in": 95.36,
    "tokens_out": 9.03,
    "total_cost_usd": 0.018604,
    "total_tokens_in": 19072.0,
    "total_tokens_out": 1806.0,
    "truncated": 0.005
  },
  "warmup_ms": 6611.031
}
