{
  "adapter": "examples/classification-dbpedia-14/adapter.py",
  "build": {
    "dirty": false,
    "ref": "73604a08b84a7def4f4569102514bdc9e9ec0238",
    "source": "git"
  },
  "config_id": "db_deepseek_m_n200_v1",
  "created_at": "2026-09-27T14:25:53Z",
  "dataset_id": "dbpedia_280",
  "fingerprint": {
    "arm": {
      "config_id": "db_deepseek_m_n200_v1",
      "labels": {
        "family": "deepseek",
        "price_tier": "mid",
        "usd_per_mtok_in": 0.15,
        "usd_per_mtok_out": 0.5
      }
    },
    "data": {
      "dataset_id": "dbpedia_280",
      "items_sha256": "a7419dc6a5876490c3ed1f96eae9398969a2f8b794e744d45ace5790bc0146f2",
      "n_items": 280,
      "reference_id": "gold/dbpedia_280",
      "reference_tier": "gold",
      "references_sha256": "e0564fe65fb011e37717e037a6ad662f44e796b7d7de8e62ed2344ba56fa7a8a"
    },
    "data_sha256": "ba266b3e1c4e465a922638baee9aea990c34420aa92c1b6ab2f97610c3e981e1",
    "deployment": {
      "declared": {
        "alias": "eval-deepseek-41flash",
        "endpoint": "http://127.0.0.1:4001",
        "id": "openrouter/deepseek/deepseek-v4.1-flash",
        "id_source": "proxy-model-info",
        "labels": [
          "Company",
          "EducationalInstitution",
          "Artist",
          "Athlete",
          "OfficeHolder",
          "MeanOfTransportation",
          "Building",
          "NaturalPlace",
          "Village",
          "Animal",
          "Plant",
          "Album",
          "Film",
          "WrittenWork"
        ],
        "labels_sha256": "d3a33437c1e2b2fe45fdb7a425b14796d89d31a0d8919d899149e27f5c6f899d",
        "parser_sha256": "6cc7cbce25ef74dbcdaa7f18763cfaaf8ea7b2a0e0cc0222e4d70f9b92cf2fc6",
        "provider": "litellm",
        "provider_routing": null
      },
      "hosted": {
        "provider": "litellm",
        "provider_id": "openrouter/deepseek/deepseek-v4.1-flash",
        "route": null
      },
      "id": "eval-deepseek-41flash",
      "in_process": false,
      "libraries": null,
      "model": "eval-deepseek-41flash",
      "provider": "litellm",
      "server": null,
      "source": "adapter",
      "weights": {
        "digest": null,
        "file_hash": null,
        "precision": null,
        "quantization": null,
        "revision": null,
        "revision_source": "api-model-string"
      },
      "where": {
        "backend": null,
        "device": null,
        "machine": null
      }
    },
    "deployment_sha256": "03f0066ee64fd7850f1a9d688fb11b331e32f4f46ac9b0fcfe6313da66bbac2b",
    "hash": "fc5d7b4cb49449839f2e0527291c751a2cc5fc7485c4402dd3b4de76fb7ca521",
    "instrument": {
      "adapter": {
        "id": "examples/classification-dbpedia-14/adapter.py",
        "sha256": "58b55c964f8bb40746c359621beb25bfd0a071fca079961bdf15be1e7c0a77a8"
      },
      "harness": {
        "commit": "73604a08b84a",
        "dirty": false
      }
    },
    "instrument_sha256": "3ac66c0eb0bb12f6e2ec8d73eccee9dd3614f0bc92c1a01be4a50c6a614bd18f",
    "runner": {
      "cpu_count": 12,
      "label": "mac-dev",
      "libraries": {
        "openai": "3.19.2"
      },
      "platform": "Darwin/x86_64",
      "processor": "i386",
      "python": "3.11.8",
      "release": "24.6.0"
    },
    "settings": {
      "declared": {
        "prompt_sha256": "758e514c7aab934f0ad0395805b4624b41946e99834b6a2ca0527e098e796db3",
        "reasoning": {
          "enabled": false
        },
        "temperature": 0.0
      },
      "max_tokens": 200,
      "prompt_file": "prompt.txt",
      "reasoning": {
        "enabled": false
      },
      "temperature": 0.0
    },
    "settings_sha256": "8c14a70088b07911142861674fddd4995b5eada33c659017f1a5f215c9879b04",
    "version": 5
  },
  "goal": "entity_topic_dbpedia",
  "metric_kinds": {
    "answer_words": "descriptive",
    "confidence": "descriptive",
    "correct": "quality",
    "correct_after_repair": "descriptive",
    "fmt_markdown": "descriptive",
    "fmt_verbose": "descriptive",
    "parsed": "quality",
    "reasoning_tokens": "descriptive",
    "truncated": "descriptive"
  },
  "n_items": 280,
  "params": {
    "family": "deepseek",
    "max_tokens": 200,
    "model": "eval-deepseek-41flash",
    "price_tier": "mid",
    "prompt_file": "prompt.txt",
    "provider": "litellm",
    "reasoning": {
      "enabled": false
    },
    "temperature": 0.0,
    "usd_per_mtok_in": 0.15,
    "usd_per_mtok_out": 0.5
  },
  "primary_metric": "correct",
  "providers_seen": {
    "Alibaba": 2,
    "AtlasCloud": 1,
    "CoreWeave": 67,
    "DeepInfra": 3,
    "DekaLLM": 3,
    "InferenceNet": 9,
    "Novita": 75,
    "OpenInference": 1,
    "Relace": 2,
    "Sail Research": 4,
    "StreamLake": 74,
    "Together": 33,
    "Wafer": 6
  },
  "reference_tier": "gold",
  "round": "r1",
  "run_id": "db_deepseek_m_n200_v1_20260927T142117Z",
  "scores": {
    "answer_words": 1.067857,
    "correct": 0.975,
    "correct_after_repair": 0.0,
    "cost_usd": 2.8e-05,
    "fmt_markdown": 0.0,
    "fmt_verbose": 0.003571,
    "latency_ms": 974.565311,
    "parsed": 0.996429,
    "reasoning_tokens": 0.0,
    "tokens_in": 138.739286,
    "tokens_out": 2.260714,
    "total_cost_usd": 0.0078503,
    "total_tokens_in": 38847.0,
    "total_tokens_out": 633.0,
    "truncated": 0.0
  },
  "warmup_ms": 2056.164
}
